slug,title,excerpt,author,readTime,category,tags,views,content
scholarship-essay-tips,"10 Essential Tips for Writing Winning Scholarship Essays","Master the art of scholarship essay writing with these proven strategies that have helped thousands of students secure funding for their education.",Dave Newton,8,"Application Tips","Essays,Writing Tips,Application Strategy,Student Success",2,"<div class='prose max-w-none'><h2>1. Start with a Compelling Hook</h2><p>Grab attention with a bold opening.</p><h2>2. Tell Your Unique Story</h2><p>Share personal experiences that set you apart.</p><h2>3. Address the Prompt Directly</h2><p>Stick to the question asked.</p><h2>4. Show, Don't Just Tell</h2><p>Use vivid examples.</p><h2>5. Demonstrate Impact and Growth</h2><p>Highlight your journey.</p><h2>6. Research the Organization</h2><p>Align with their values.</p><h2>7. Use a Clear Structure</h2><p>Organize your thoughts.</p><h2>8. Edit Ruthlessly</h2><p>Polish your draft.</p><h2>9. Stay Within Word Limits</h2><p>Respect the rules.</p><h2>10. End with a Strong Conclusion</h2><p>Leave a lasting impression.</p></div>"
college-application-guide,"The Ultimate Guide to College Applications","Navigate the college application process with confidence using our comprehensive guide.",Sarah Lee,10,"Application Tips","College,Applications,Guides",15,"<div class='prose max-w-none'><h2>1. Build a Timeline</h2><p>Start early and plan ahead.</p><h2>2. Research Schools</h2><p>Find the right fit for your goals.</p><h2>3. Prepare Your Materials</h2><p>Gather transcripts, test scores, and recommendations.</p><h2>4. Write a Strong Personal Statement</h2><p>Tell your story with clarity and purpose.</p><h2>5. Apply Strategically</h2><p>Balance reach, match, and safety schools.</p></div>"
study-habits-success,"Top Study Habits for Academic Success","Boost your grades and retention with these effective study habits.",James Carter,6,"Study Tips","Study Habits,Academic Success,Time Management",25,"<div class='prose max-w-none'><h2>1. Set a Schedule</h2><p>Consistency is key.</p><h2>2. Use Active Recall</h2><p>Test yourself regularly.</p><h2>3. Take Breaks</h2><p>Use the Pomodoro technique.</p><h2>4. Stay Organized</h2><p>Keep notes and materials tidy.</p><h2>5. Review Often</h2><p>Repetition builds memory.</p></div>"
online-learning-tools,"Best Online Tools for Remote Learning","Discover the top tools that make online learning more efficient and engaging.",Linda Moore,7,"Tech in Education","Online Learning,EdTech,Tools",30,"<div class='prose max-w-none'><h2>1. Video Platforms</h2><p>Zoom and Google Meet for live sessions.</p><h2>2. Collaboration Tools</h2><p>Use Notion, Slack, or Trello.</p><h2>3. Note-Taking Apps</h2><p>Try Evernote or Obsidian.</p><h2>4. Flashcard Systems</h2><p>Anki and Quizlet for memorization.</p><h2>5. File Sharing</h2><p>Google Drive and Dropbox.</p></div>"
time-management-students,"Time Management Strategies for Students","Learn how to manage your time effectively to balance academics and personal life.",Tom Richards,5,"Study Tips","Time Management,Student Life,Efficiency",18,"<div class='prose max-w-none'><h2>1. Prioritize Tasks</h2><p>Use the Eisenhower Matrix.</p><h2>2. Plan Weekly</h2><p>Schedule your goals.</p><h2>3. Avoid Multitasking</h2><p>Focus on one task at a time.</p><h2>4. Use Timers</h2><p>Track your productivity.</p><h2>5. Reflect Weekly</h2><p>Adjust your strategy.</p></div>"
exam-preparation-guide,"A Complete Guide to Exam Preparation","Ace your exams with this step-by-step preparation guide.",Emily Stone,9,"Study Tips","Exams,Preparation,Success",22,"<div class='prose max-w-none'><h2>1. Understand the Format</h2><p>Know what to expect.</p><h2>2. Create a Study Plan</h2><p>Break topics into manageable chunks.</p><h2>3. Practice Past Papers</h2><p>Simulate exam conditions.</p><h2>4. Join Study Groups</h2><p>Collaborate and learn.</p><h2>5. Stay Healthy</h2><p>Eat, sleep, and hydrate.</p></div>"
financial-aid-basics,"Understanding the Basics of Financial Aid","Get a clear overview of financial aid options available for students.",Michael Brown,6,"Financial Aid","Financial Aid,Scholarships,Loans",12,"<div class='prose max-w-none'><h2>1. Types of Aid</h2><p>Grants, loans, and work-study.</p><h2>2. FAFSA Explained</h2><p>How to apply for federal aid.</p><h2>3. Scholarships</h2><p>Merit and need-based options.</p><h2>4. Budgeting Tips</h2><p>Manage your funds wisely.</p><h2>5. Avoid Debt Traps</h2><p>Borrow responsibly.</p></div>"
career-planning-students,"Career Planning Tips for High School Students","Start planning your future career with these actionable tips.",Rachel Green,7,"Career Advice","Career Planning,High School,Future Goals",20,"<div class='prose max-w-none'><h2>1. Self-Assessment</h2><p>Identify your strengths.</p><h2>2. Explore Careers</h2><p>Use online tools and interviews.</p><h2>3. Set Goals</h2><p>Short-term and long-term planning.</p><h2>4. Build Skills</h2><p>Volunteer and take courses.</p><h2>5. Seek Mentorship</h2><p>Learn from professionals.</p></div>"
college-interview-prep,"How to Prepare for College Admission Interviews","Make a great impression with these college interview preparation tips.",Kevin White,5,"Application Tips","Interviews,College Admission,Preparation",10,"<div class='prose max-w-none'><h2>1. Research the School</h2><p>Know their values and programs.</p><h2>2. Practice Common Questions</h2><p>Prepare thoughtful answers.</p><h2>3. Dress Professionally</h2><p>Make a strong first impression.</p><h2>4. Be Yourself</h2><p>Authenticity matters.</p><h2>5. Follow Up</h2><p>Send a thank-you note.</p></div>"
student-mental-health,"Supporting Student Mental Health in School","Explore strategies for maintaining mental health during your academic journey.",Anna Bell,8,"Wellness","Mental Health,Wellness,Student Support",28,"<div class='prose max-w-none'><h2>1. Recognize Stress</h2><p>Know the signs.</p><h2>2. Build Support Networks</h2><p>Talk to friends and counselors.</p><h2>3. Practice Mindfulness</h2><p>Use meditation and breathing techniques.</p><h2>4. Stay Active</h2><p>Exercise regularly.</p><h2>5. Seek Help Early</h2><p>Don't wait to reach out.</p></div>"
